{
  "$schema": "https://json-schema.org/draft/2020-12/schema",
  "$id": "https://bloomcrm.dev/schemas/project-model.schema.json",
  "title": "project-model",
  "type": "object",
  "required": ["schemaVersion", "knowledgeModel", "planningModel", "backlog"],
  "additionalProperties": true,
  "properties": {
    "schemaVersion": { "type": "string" },
    "generatedAt": { "type": ["string", "null"] },
    "source": {
      "type": "object",
      "properties": {
        "repo": { "type": ["string", "null"] },
        "commit": { "type": ["string", "null"] },
        "branch": { "type": ["string", "null"] }
      }
    },
    "knowledgeModel": {
      "type": "object",
      "required": ["domains"],
      "properties": {
        "domains": { "type": "array" },
        "architecture": { "type": "array" },
        "techDebt": { "type": "array" },
        "infrastructure": { "type": "array" },
        "security": { "type": "array" },
        "risks": { "type": "array" }
      }
    },
    "planningModel": {
      "type": "object",
      "properties": {
        "phases": { "type": "array", "items": { "type": "string" } },
        "items": { "type": "array" }
      }
    },
    "backlog": {
      "type": "object",
      "required": ["epics"],
      "properties": {
        "epics": {
          "type": "array",
          "items": {
            "type": "object",
            "required": ["id", "phase", "type", "title", "stories"],
            "properties": {
              "id": { "type": "string" },
              "trackerKey": { "type": ["string", "null"] },
              "phase": { "type": "string" },
              "type": { "type": "string", "enum": ["feature", "bug", "techdebt"] },
              "title": { "type": "string" },
              "stories": {
                "type": "array",
                "items": {
                  "type": "object",
                  "required": ["id", "title", "acceptanceCriteria", "definitionOfDone", "tasks"],
                  "properties": {
                    "id": { "type": "string" },
                    "trackerKey": { "type": ["string", "null"] },
                    "title": { "type": "string" },
                    "needsDecision": { "type": "boolean" },
                    "acceptanceCriteria": {
                      "type": "array",
                      "minItems": 1,
                      "items": {
                        "type": "object",
                        "required": ["given", "when", "then"],
                        "properties": {
                          "given": { "type": "string" },
                          "when": { "type": "string" },
                          "then": { "type": "string" }
                        }
                      }
                    },
                    "definitionOfDone": {
                      "type": "array",
                      "minItems": 1,
                      "items": { "type": "string" }
                    },
                    "tasks": {
                      "type": "array",
                      "items": {
                        "type": "object",
                        "required": ["id", "category"],
                        "properties": {
                          "id": { "type": "string" },
                          "trackerKey": { "type": ["string", "null"] },
                          "category": {
                            "type": "string",
                            "enum": ["backend", "frontend", "database", "validation", "tests", "documentation", "logging", "monitoring", "migration", "admin", "design"]
                          },
                          "subtasks": { "type": "array" }
                        }
                      }
                    }
                  }
                }
              }
            }
          }
        }
      }
    }
  }
}
